paragraph,category
Is log 4? equal to log 2+? Are the equations x=5 and log x=log5 equivalent? Is the equation log 7 = log x equivalent to the equation 7 =x7?,Compare-and-contrast examples
Use the ideas from problem 6-54 to help you solve the following equations. a. log10=log(2x- 3) b. log 25 =log(4x?,N/A
"Find an equation for each of the lines described below. The line with slope - that goes through the point (0, 5). The line parallel to y=2x—5 that goes through the point (1, 7). The line perpendicular to y=2x-—5 that goes through the point (1, 7). The line that goes through the point (0, 0) so that the tangent of the angle it makes with the x-axis is 2.",N/A
Solve each equation below for y so that it can be entered into the graphing calculator.,N/A
Sketch the graph of each equation or inequality below. =9 b. (x-2)* + (y+ 3)?,N/A
"You are standing 60 feet away from a five-story building in Los Angeles, looking up at its rooftop. In the distance you can see the billboard on top of your hotel, but the building is completely obscured by the one in front of you. If your hotel is 32 stories tall and the average story is 10 feet high, how far away from your hotel are you?",N/A
that passes through three specific points. You will be challenged to extend what you know about writing and solving a system of equations in two variables to solving a system of equations in three variables.,N/A
"In your work with parabolas, you have developed two forms for the general equation of a quadratic function: y= +k. What information does each equation give you about the graph of a parabola? Be as detailed in your explanation as possible. When is each form most useful?",Compare-and-contrast examples
"Suppose the graph of a quadratic function passes through the points (1, 0), (2,5), and (3, 12). Then work with your team to develop an algebraic method to find the equation y = ax? + bx +c of this specific quadratic function.",N/A
How many points does it take to determine the equation of a linear function y=ax+b? Discuss this with your team and include at least one sketch to support your answer.,N/A
"Now think about the graph of a quadratic function y = ax* +bx+c. How many points do you think it would take to determine this graph? Does there need to be any restriction on the points you use? Discuss these questions with your team and justify your answers before moving on to part (a). a. Suppose you wanted the graph of a quadratic function y= +bx+c to pass through the points (1,0), (2,5), and (3, 12). How would these points be useful in finding the specific equation of this function? If your team has not already done so, include a sketch of the parabola going through these points to support your answer. It is often useful to label points with the variable they represent. For instance, for the point (3, 12), which variable does the 3 represent? Which variable does the 12 represent? Using the general equation of a quadratic, y = ax? + bx +c , substitute the x- and y-values from your first point into the equation. Then do the same for the other two points to create three equations where the unknowns are a,b,and c. d. Now use the strategies you developed in Lesson 6.1.4 to solve the system of equations for a, b, and c. e. Use your results to write the equation of the quadratic function that passes through the points (1, 0), (2,5), and (3, 12). How can you check your answer? That is, how can you make sure your equation would actually go through the three points? Using the method your team decides on, check your equation.",N/A
+bx+c of the quadratic function whose graph passes through three given points. Title this entry “Finding the Equation of a Parabola Given Three Points” and label it with today’s date.,N/A
"Find the equation y= ax? +bx+c of the function that passes through the three points given in parts (a) and (b) below. Be sure to check your answers. a. (3,10), (5, 36), and (—2, 15) b. (2,2), (4,5), and (6, 0)",N/A
"CPM engineers are considering developing a private space rocket. In a computer simulation, the rocket is approaching a star and is caught in its gravitational pull. When the rocket’s engines are fired, the rocket will slow down, stop momentarily, and then pick up speed and move away from the star, avoiding its gravitational field. CPM engaged the rocket engines when it was 750 thousand miles from the star. After one full minute, the rocket was 635 thousand miles from the star. After two minutes, the ship was 530 thousand miles from the star. a. Name the three points given in the information above if x = the time since the engines were engaged and y = the distance (in thousands of miles) from the star. Based on the points in part (a), make a rough sketch of a graph that shows the distance reaching a minimum and then increasing again, over time. What kind of function could follow this pattern? Find the equation of a graph that fits the three points you found in part (a). Ifthe ship comes within 50 thousand miles of the star, the shields will fail and the ship will burn up. Use your equation to determine whether the space ship has failed to escape the gravity of the star.",N/A
Sickly Sid has contracted a serious infection and has gone to the doctor for help.,N/A
"After ten days, the infection has grown to 1600 bacteria per cc. After 15 days it has grown",N/A
"Sensible Sally has a job that is 35 miles from her home and needs to be at work by 8:15 a.m. She wants to get as much sleep as she can, leave as late",N/A
"a. Name three data points given in the problem statement. Make a rough sketch that will show the number of bacteria per cc over time. Find the equation of the parabola that contains the three data points. Based on the equation, how long will it take until the bacteria are eliminated? Based on the equation, how long had Sid been infected before he went to",N/A
"as possible, and still get to work on time. Sally discovered that if she leaves at 7:10, it takes her 40 minutes to get to work. If she leaves at 7:30, it takes her 60 minutes to get work. If she leaves at 7:40, it takes her 50 minutes to get to work. Since her commute time increases and then decreases, Sally decided to use a parabola to model her commute, assuming the time it takes her to get to work varies quadratically with the number of minutes after 7:00 that she leaves her house. a. Ifx =the number of minutes after 7:00 that Sally leaves, and y = the number of minutes it takes Sally to get to work, what three ordered pairs can you determine from the problem? Use the three points from part (a) to find the equation of a parabola in standard form that can be used to model Sally’s commute. c. Will Sally make it to work on time if she leaves at 7:20?",N/A
"Your challenge will be to work with a partner to create a parabola puzzle for another pair of students to solve. Follow the directions below to create a puzzle that will make them think and allow them to show off their algebra skills. When you are ready, you will trade puzzles with another pair and attempt to solve theirs. a. With your partner, decide on an equation for a parabola and then identify three points that lie on its graph. Keep track of how you came up with your equation and how you chose your points.",N/A
"Write the coordinates of the three points on an index card or small slip of paper to give to another pair of students. Be sure you keep a copy of your equation so you can check their work later. c. Trade points with another pair and work with your partner to solve their puzzle. When you are confident of your equation, check your work with the pair that wrote it.",N/A
"that passes through a given set of points when graphed, y= ax*+bx* +cx+d. How many points do you think you would need to be given to be able to determine a unique equation? How could you extend the method you developed for solving a quadratic to solving a cubic?",N/A
Solve the system of equations at right and then check your x—2y + 3z=8 solution in each equation. Be sure to keep your work well 2x+y+z=6 organized.,N/A
"Find the equation in y= ax? +bx+c form of the parabola that passes through the points (1, 5), (3, 19), and (—2, 29).",N/A
This problem is a checkpoint for multiplying and dividing rational expressions. gy \t will be referred to as Checkpoint 6A.,N/A
"a. x2-16 , x2~3x-18 b x2-1 is x3+x2-2x (x-4)* x2-2x-24 ” enx®lowe7 x-7",N/A
Check your answers by referring to the Checkpoint 6A materials located at the back of your book.,N/A
"If you needed help solving these problems correctly, then you need more practice. Review the Checkpoint 6A materials and try the practice problems. Also, consider getting help outside of class time. From this point on, you will be expected to do problems like these quickly and easily.",N/A
Simplify each expression in parts (a) through (c) below. Then complete part (d).,N/A
What expression would go in the box to make the equation o¢ + =2y+7x true?,N/A
"Change each of the following equations from logarithmic form to exponential form, or vice versa.",N/A
"The half-life of an isotope is 1000 years. A 50-gram sample of the isotope is sealed in a box. a. How muchis left after 10,000 years? How long will it take to reduce to 1% of the original amount? How long will it take until all of the original sample of the isotope is gone?",N/A
a. Now shift the function down 3 and to the left 2 and draw the new graph on,N/A
